{
  "schemaVersion": "practice-topik35-reading-question-payload-v1",
  "packageId": "topik35-v1-reading-question-payload-v1",
  "sourceAuditId": "topik35-v1-reading-source-identity-audit-20260803",
  "bundleId": "topik35-v1",
  "capturedAt": "2026-08-03",
  "status": "QUESTION_OPTION_ANSWER_GROUP_AND_ASSET_QA_COMPLETE_LOAD_BLOCKED",
  "skill": "READING",
  "sourceAuthority": {
    "questionArtifactId": "topik35-reading-pdf",
    "questionArtifactSha256": "d3618891f8afdb4739754067ab8268632998fc522ee0a5519b1286984454a4cd",
    "questionArtifactPageCount": 23,
    "answerArtifactId": "topik35-answer-key-pdf",
    "answerArtifactSha256": "60fb5fa5e5a211609d0d6e36bc1cacc490c34ff5a0009e6952e931f9a850d17b",
    "answerArtifactPageCount": 3,
    "answerAuthorityPdfPage": 3,
    "sourceAnnotationsAreAnswerAuthority": false,
    "readingTranscriptProvided": false,
    "separateReadingAssetRouteProvided": false
  },
  "storagePolicy": {
    "logicalKeyOnly": true,
    "localDerivedAssetsIgnored": true,
    "objectStoreWrite": false,
    "bucketOrDeliveryUrlStored": false
  },
  "panePolicy": {
    "groupMetadataDrivesReadingPane": true,
    "passageSourceField": "passageGroups[].passageText",
    "assetSourceField": "passageGroups[].visualAssetIds",
    "questionNavigationSelectsGroup": true,
    "automaticQuestionNavigation": false,
    "learnerSurfaceChangedByThisSlice": false
  },
  "markerContract": {
    "blankMarker": "[BLANK]",
    "insertionMarkers": ["[SLOT_1]", "[SLOT_2]", "[SLOT_3]", "[SLOT_4]"],
    "markersArePresentationMetadataNotSourceText": true
  },
  "pageQa": [
    {"pdfPage": 3, "printedPage": 1, "questionFrom": 1, "questionTo": 4, "qaStatus": "VISUALLY_VERIFIED"},
    {"pdfPage": 4, "printedPage": 2, "questionFrom": 5, "questionTo": 8, "qaStatus": "VISUALLY_VERIFIED"},
    {"pdfPage": 5, "printedPage": 3, "questionFrom": 9, "questionTo": 10, "qaStatus": "VISUALLY_VERIFIED"},
    {"pdfPage": 6, "printedPage": 4, "questionFrom": 11, "questionTo": 12, "qaStatus": "VISUALLY_VERIFIED"},
    {"pdfPage": 7, "printedPage": 5, "questionFrom": 13, "questionTo": 15, "qaStatus": "VISUALLY_VERIFIED"},
    {"pdfPage": 8, "printedPage": 6, "questionFrom": 16, "questionTo": 17, "qaStatus": "VISUALLY_VERIFIED"},
    {"pdfPage": 9, "printedPage": 7, "questionFrom": 18, "questionTo": 20, "qaStatus": "VISUALLY_VERIFIED"},
    {"pdfPage": 10, "printedPage": 8, "questionFrom": 21, "questionTo": 22, "qaStatus": "VISUALLY_VERIFIED"},
    {"pdfPage": 11, "printedPage": 9, "questionFrom": 23, "questionTo": 24, "qaStatus": "VISUALLY_VERIFIED"},
    {"pdfPage": 12, "printedPage": 10, "questionFrom": 25, "questionTo": 27, "qaStatus": "VISUALLY_VERIFIED"},
    {"pdfPage": 13, "printedPage": 11, "questionFrom": 28, "questionTo": 29, "qaStatus": "VISUALLY_VERIFIED"},
    {"pdfPage": 14, "printedPage": 12, "questionFrom": 30, "questionTo": 31, "qaStatus": "VISUALLY_VERIFIED"},
    {"pdfPage": 15, "printedPage": 13, "questionFrom": 32, "questionTo": 33, "qaStatus": "VISUALLY_VERIFIED"},
    {"pdfPage": 16, "printedPage": 14, "questionFrom": 34, "questionTo": 35, "qaStatus": "VISUALLY_VERIFIED"},
    {"pdfPage": 17, "printedPage": 15, "questionFrom": 36, "questionTo": 37, "qaStatus": "VISUALLY_VERIFIED"},
    {"pdfPage": 18, "printedPage": 16, "questionFrom": 38, "questionTo": 39, "qaStatus": "VISUALLY_VERIFIED"},
    {"pdfPage": 19, "printedPage": 17, "questionFrom": 40, "questionTo": 41, "qaStatus": "VISUALLY_VERIFIED"},
    {"pdfPage": 20, "printedPage": 18, "questionFrom": 42, "questionTo": 43, "qaStatus": "VISUALLY_VERIFIED"},
    {"pdfPage": 21, "printedPage": 19, "questionFrom": 44, "questionTo": 45, "qaStatus": "VISUALLY_VERIFIED"},
    {"pdfPage": 22, "printedPage": 20, "questionFrom": 46, "questionTo": 47, "qaStatus": "VISUALLY_VERIFIED"},
    {"pdfPage": 23, "printedPage": 21, "questionFrom": 48, "questionTo": 50, "qaStatus": "VISUALLY_VERIFIED"}
  ],
  "visualAssets": [
    {
      "assetId": "topik35-reading-q09-table",
      "role": "PASSAGE_TABLE",
      "questionNumbers": [9],
      "logicalKey": "practice-seed/topik35-v1/derived/page-image/2bb6a1b88df53a1aafd6e1f70906f0aa1068f46079b060123df0c2c215d81e85.png",
      "mediaType": "image/png",
      "sha256": "2bb6a1b88df53a1aafd6e1f70906f0aa1068f46079b060123df0c2c215d81e85",
      "sizeBytes": 121704,
      "width": 1120,
      "height": 580,
      "source": {"artifactId": "topik35-reading-pdf", "artifactSha256": "d3618891f8afdb4739754067ab8268632998fc522ee0a5519b1286984454a4cd", "pdfPage": 5, "printedPage": 3, "renderDpi": 200, "cropPixels": {"x": 290, "y": 335, "width": 1120, "height": 580}},
      "qaStatus": "VISUALLY_VERIFIED"
    },
    {
      "assetId": "topik35-reading-q10-chart",
      "role": "PASSAGE_CHART",
      "questionNumbers": [10],
      "logicalKey": "practice-seed/topik35-v1/derived/page-image/734ae3aa61930d951e8a2a800409712d6d73fe8bfef6bf13fe311538a6b671ca.png",
      "mediaType": "image/png",
      "sha256": "734ae3aa61930d951e8a2a800409712d6d73fe8bfef6bf13fe311538a6b671ca",
      "sizeBytes": 52556,
      "width": 940,
      "height": 500,
      "source": {"artifactId": "topik35-reading-pdf", "artifactSha256": "d3618891f8afdb4739754067ab8268632998fc522ee0a5519b1286984454a4cd", "pdfPage": 5, "printedPage": 3, "renderDpi": 200, "cropPixels": {"x": 360, "y": 1300, "width": 940, "height": 500}},
      "qaStatus": "VISUALLY_VERIFIED"
    }
  ],
  "passageGroups": [
    {"groupId":"R001","questionNumbers":[1],"sourcePdfPage":3,"sourcePrintedPage":1,"instruction":"빈칸에 들어갈 가장 알맞은 것을 고르십시오.","passageText":"어제는 친구들과 같이 점심을 [BLANK] 바로 도서관에 갔다.","blankCount":1,"insertionSlotCount":0,"visualAssetIds":[],"qaStatus":"VISUALLY_VERIFIED"},
    {"groupId":"R002","questionNumbers":[2],"sourcePdfPage":3,"sourcePrintedPage":1,"instruction":"빈칸에 들어갈 가장 알맞은 것을 고르십시오.","passageText":"이사 갈 집을 [BLANK] 방학 때 좀 바빴다.","blankCount":1,"insertionSlotCount":0,"visualAssetIds":[],"qaStatus":"VISUALLY_VERIFIED"},
    {"groupId":"R003","questionNumbers":[3],"sourcePdfPage":3,"sourcePrintedPage":1,"instruction":"밑줄 친 부분과 의미가 비슷한 것을 고르십시오.","passageText":"어제 본 공연은 눈물이 날 정도로 감동적이었다.","blankCount":0,"insertionSlotCount":0,"visualAssetIds":[],"qaStatus":"VISUALLY_VERIFIED"},
    {"groupId":"R004","questionNumbers":[4],"sourcePdfPage":3,"sourcePrintedPage":1,"instruction":"밑줄 친 부분과 의미가 비슷한 것을 고르십시오.","passageText":"두 사람은 오랫동안 알고 지냈지만 직장 동료 사이일 뿐이다.","blankCount":0,"insertionSlotCount":0,"visualAssetIds":[],"qaStatus":"VISUALLY_VERIFIED"},
    {"groupId":"R005","questionNumbers":[5],"sourcePdfPage":4,"sourcePrintedPage":2,"instruction":"무엇에 대한 글인지 고르십시오.","passageText":"날마다 새로운 세상을 읽는다. 세상을 보는 눈!","blankCount":0,"insertionSlotCount":0,"visualAssetIds":[],"qaStatus":"VISUALLY_VERIFIED"},
    {"groupId":"R006","questionNumbers":[6],"sourcePdfPage":4,"sourcePrintedPage":2,"instruction":"무엇에 대한 글인지 고르십시오.","passageText":"아프세요? 참지 마세요. 상담부터 수술까지 친절하게 도와 드리겠습니다.","blankCount":0,"insertionSlotCount":0,"visualAssetIds":[],"qaStatus":"VISUALLY_VERIFIED"},
    {"groupId":"R007","questionNumbers":[7],"sourcePdfPage":4,"sourcePrintedPage":2,"instruction":"무엇에 대한 글인지 고르십시오.","passageText":"숲에서 부는 시원한 바람. 숲에서 사는 귀여운 동물. 숲이 없어지면 이 모든 것이 없어집니다.","blankCount":0,"insertionSlotCount":0,"visualAssetIds":[],"qaStatus":"VISUALLY_VERIFIED"},
    {"groupId":"R008","questionNumbers":[8],"sourcePdfPage":4,"sourcePrintedPage":2,"instruction":"무엇에 대한 글인지 고르십시오.","passageText":"궁금하신 점은 서울화장품 홈페이지 고객 게시판에 남겨 주십시오. 상담원과 통화를 원하시면 080-987-6543으로 전화해 주십시오.","blankCount":0,"insertionSlotCount":0,"visualAssetIds":[],"qaStatus":"VISUALLY_VERIFIED"},
    {"groupId":"R009","questionNumbers":[9],"sourcePdfPage":5,"sourcePrintedPage":3,"instruction":"도표의 내용과 같은 것을 고르십시오.","passageText":"제10회 서울국제꽃박람회. 입장료: 일반 9,000원, 단체(20인 이상) 7,000원, 특별권 10,000원. 단체 요금은 평일에만 가능하다. 특별권 구입 시 행사장 내 놀이 시설을 무료로 이용할 수 있다. 대중교통 이용자는 입장료 1,000원을 할인받는다.","blankCount":0,"insertionSlotCount":0,"visualAssetIds":["topik35-reading-q09-table"],"qaStatus":"VISUALLY_VERIFIED"},
    {"groupId":"R010","questionNumbers":[10],"sourcePdfPage":5,"sourcePrintedPage":3,"instruction":"도표의 내용과 같은 것을 고르십시오.","passageText":"애완동물을 어디에서 구하셨습니까? 아는 사람 39.3%, 애완동물 가게 36.7%, 인터넷 16.8%, 버려진 동물 7.2%.","blankCount":0,"insertionSlotCount":0,"visualAssetIds":["topik35-reading-q10-chart"],"qaStatus":"VISUALLY_VERIFIED"},
    {"groupId":"R011","questionNumbers":[11],"sourcePdfPage":6,"sourcePrintedPage":4,"instruction":"글의 내용과 같은 것을 고르십시오.","passageText":"최근 70~80년대를 경험해 볼 수 있는 문화 공간이 생겼다. 서울시에서 새로 문을 연 ‘추억극장’이 바로 그곳이다. 입장료 2,000원만 내면 남녀노소 누구나 그때 유행했던 영화를 관람할 수 있으며 커피와 차, 과자 등 간단한 간식도 먹을 수 있다. 극장 내부에는 추억의 영화 포스터, 영화표 등이 전시되어 있다.","blankCount":0,"insertionSlotCount":0,"visualAssetIds":[],"qaStatus":"VISUALLY_VERIFIED"},
    {"groupId":"R012","questionNumbers":[12],"sourcePdfPage":6,"sourcePrintedPage":4,"instruction":"글의 내용과 같은 것을 고르십시오.","passageText":"사람들은 가끔씩 지금과는 다른 내가 되고 싶어 한다. 이런 마음은 가면을 통해서 나타낼 수 있는데 가면을 쓰면 잠시 동안이지만 현실과 다른 나를 표현할 수 있다. 예를 들어 힘이 약한 사람이 호랑이 가면을 쓰게 되면 호랑이처럼 힘이 세다고 생각한다. 그래서 정말 힘센 사람처럼 행동하게 되고 이를 통해 스스로 만족하게 된다.","blankCount":0,"insertionSlotCount":0,"visualAssetIds":[],"qaStatus":"VISUALLY_VERIFIED"},
    {"groupId":"R013","questionNumbers":[13],"sourcePdfPage":7,"sourcePrintedPage":5,"instruction":"문장을 순서대로 맞게 배열한 것을 고르십시오.","passageText":"(가) 또한 재료 가격이 싸서 제작 비용도 적게 든다. (나) 그중 하나가 운동선수들의 유니폼을 만드는 것이다. (다) 플라스틱 병을 재활용하는 방법에는 여러 가지가 있다. (라) 플라스틱 병을 소재로 해서 운동복을 만들면 가볍고 시원하다.","blankCount":0,"insertionSlotCount":0,"visualAssetIds":[],"qaStatus":"VISUALLY_VERIFIED"},
    {"groupId":"R014","questionNumbers":[14],"sourcePdfPage":7,"sourcePrintedPage":5,"instruction":"문장을 순서대로 맞게 배열한 것을 고르십시오.","passageText":"(가) 그러자 남자는 다른 쪽 신발도 벗어 그 옆으로 떨어뜨렸다. (나) 남자가 신발을 주우려고 했지만 기차가 움직이기 시작했다. (다) 신발의 짝이 맞아야 누군가 신을 수 있다고 생각했기 때문이었다. (라) 남자가 기차에 타려는 순간 신발 한 짝이 벗겨져 아래로 떨어졌다.","blankCount":0,"insertionSlotCount":0,"visualAssetIds":[],"qaStatus":"VISUALLY_VERIFIED"},